tema,pregunta_frecuente,respuesta,politica_oficial
Devoluciones,"¿Cuántos días tengo para devolver un producto?","Tienes un plazo máximo de 30 días calendario desde la fecha de recepción del producto para solicitar una devolución.","Política de Reembolsos y Devoluciones v2.1"
Devoluciones,"¿En qué condiciones debe estar el producto para ser devuelto?","El producto debe estar en su embalaje original, sin signos de uso, con todas sus etiquetas y accesorios completos.","Política de Reembolsos y Devoluciones v2.1"
Reembolsos,"¿Cuánto tiempo tarda en procesarse mi reembolso?","Una vez que recibimos el producto en nuestros almacenes y aprobamos la devolución, el reembolso se procesará en un plazo de 5 a 7 días hábiles a tu método de pago original.","Política de Reembolsos y Devoluciones v2.1"
Envíos,"¿BimBam Buy cubre los gastos de envío de las devoluciones?","Si la devolución es por un defecto de fábrica o error nuestro, cubrimos el 100% de los gastos de envío. Si es por cambio de opinión, el cliente asume el costo de envío de retorno.","Guía de Tiempos y Costos de Envío"
Garantía,"¿Cuánto tiempo de garantía tienen los productos electrónicos?","Todos los productos electrónicos vendidos por BimBam Buy cuentan con una garantía de 12 meses directamente con el fabricante por defectos de fábrica.","Manual de Garantía de Productos"
Afiliados,"¿Cómo funciona el programa de afiliados?","Puedes ganar una comisión del 5% por cada venta realizada a través de tu enlace de afiliado personalizado. Los pagos se realizan mensualmente al alcanzar un mínimo de $50 USD.","Programa de Afiliados de BimBam Buy"
Envíos,"¿Hacen envíos internacionales?","Sí, realizamos envíos a toda Latinoamérica. Los tiempos de entrega internacionales varían entre 7 y 15 días hábiles dependiendo del país de destino.","Guía de Tiempos y Costos de Envío"
Pagos,"¿Qué métodos de pago aceptan?","Aceptamos tarjetas de crédito y débito (Visa, Mastercard, American Express), PayPal y transferencias bancarias directas.","Preguntas Frecuentes sobre Métodos de Pago"
Atención al Cliente,"¿Cuál es el horario de atención al cliente?","Nuestro equipo de soporte está disponible 24/7 a través de nuestro chat en vivo y respondemos correos electrónicos en un plazo máximo de 12 horas.","Manual Operativo Interno"
